JobTitle,Company,Location,Salary,PostDate,Summary,JobUrl
Administrative Asst./ Coordinator,Multiplex Cleaning Services,Dubai,"Update and maintain office policies and procedures.
Order office supplies and research new deals and suppliers.
Plan meetings and take detailed minutes.",,24 days ago,https://ae.indeed.com/company/Multiplex-Cleaning-Services/jobs/Administrative-Assistant-38023a1668bca389?fccid=cbf11d449b5008f1&vjs=3
Administrative Assistant Cum sales,Freeline Maintenance and cleaning services LLC,Dubai,"We are looking for experienced female candidates for office administrative assistant cum sales, the candidate must have two yrs minimum experience in UAE market…",,27 days ago,https://ae.indeed.com/company/freeline-Maintenance-and-cleaning-services-LLC/jobs/Administrative-Assistant-Cum-Sales-b9ae660f833e2c23?fccid=689ce2c2859f4634&vjs=3
Housekeeping Office Coordinator /Order Taker,GRAND EXCELSIOR HOTEL DEIRA,Dubai,"Take charge and operate office without supervision for long periods.
Check that all inter-office memos are dispatched and collected.",,30+ days ago,https://ae.indeed.com/company/GRAND-EXCELSIOR-HOTEL-DEIRA/jobs/Housekeeping-Office-Coordinator-6b07226de742dd6c?fccid=cc2e7500aec8111d&vjs=3
Receptionist / Admin Assistant,AMS International,Dubai,"Must be fluent in English and Hindi.
Customer service: 1 year (Preferred).",,29 days ago,https://ae.indeed.com/company/AMS-MARINE/jobs/Receptionist-dda27fab53a4d48f?fccid=da7fd19583529fd2&vjs=3
Female Russian Speaker Office Office Administrator,PEROrient Building Contracting LLC,Dubai Silicon Oasis,"Proven experience as an office administrator, office assistant or relevant role.
The tasks of the office administrator will include bookkeeping and mentoring…",,3 days ago,https://ae.indeed.com/company/PEROrient-Building-Contracting-LLC/jobs/Female-Russian-Speaker-Office-Office-Administrator-788a1f08753c3f5e?fccid=e512483c925cdd4e&vjs=3
Personal Assistant,GI Pharma,Dubai,"Devise and maintain office filing system.
In-depth knowledge of MS Excel, office management systems and procedures.
Job Types: Full-time, Permanent.",,28 days ago,https://ae.indeed.com/company/ShineDubai/jobs/Personal-Assistant-e7c1746bc08e906e?fccid=917c3845561dbae1&vjs=3
Admin cum Accounts Assistant MATERNITY COVER,EOMAC,Dubai,"Track office licenses, leases and insurances.
With projects located throughout the GCC an administrator cum accountant is required to support the operation,…",,4 days ago,https://ae.indeed.com/company/EOMAC-UK-Ltd./jobs/Admin-Cum-Account-Assistant-Maternity-Cover-a6a7312996f3bbe2?fccid=109d5ce52a89a424&vjs=3
Accountant and Admin Executive and Secretary,Diamond Legal Translation,Dubai,"Bank Reconciliations and payment preparation.
Professional using Tally ERP.
Job Types: Full-time, Contract, Permanent.",,8 days ago,https://ae.indeed.com/company/Diamond-Legal-Translation/jobs/Accountant-Admin-Executive-Secretary-90d311f2051510c8?fccid=b33537e19e3f7864&vjs=3
Female Accounts Assistant,MERCURY FREIGHT SERVICES FZE,Sharjah,"Accounts assistant: 1 year (Required).
This position will interact directly with the Owner.
Participates in the preparation of various financial statements and…",,30+ days ago,https://ae.indeed.com/company/Mercury-Freight-Services-FZE/jobs/Female-Account-Assistant-6ac94d4aac4af2d5?fccid=b5a39c87c6c5e756&vjs=3
Sales Coordinator Assistant,New Horizon Building Material Trading LLC,Al Qusais,"Candidate should have strong hold on written and spoken English.
Well versed with computer and can handle independently all the correspondences.",,5 days ago,https://ae.indeed.com/company/New-Horizon-Building-Material-Trading-LLC/jobs/Sales-Coordinator-Assistant-15cdfc154cfd1d7a?fccid=7213792c23fc1c90&vjs=3
Assistant Financial Controller,AVANA Capital,Dubai,"Years of Experience: At least 10 years.
Education: Degree in Accounting or any related Finance courses.
Must be: CA/Member of ICAI, ACCA or CPA.",,26 days ago,https://ae.indeed.com/company/AVANA-Capital/jobs/Assistant-Financial-Controller-4bf0d5d16a11c1be?fccid=7c823cf91e02f634&vjs=3
General Assistant,Group L,UAE,"Clean office premises, kitchen area and equipment as per prescribed hygiene standards to ensure that it.
No formal education is required although some numerical…",,Today,https://ae.indeed.com/rc/clk?jk=6b9d41644263ea41&fccid=cf20bd4f52dd7f49&vjs=3
Travel Agent/Admin/Customer Services,ATG WORLD,Dubai,"Ordering and taking stock of office supplies.
Answering and directing phone calls to relevant staff.
Taking notes and minutes in meetings.",,24 days ago,https://ae.indeed.com/company/ATG-World/jobs/Travel-Agent-Admin-Customer-Service-ad8f5d481d79d2f2?fccid=bc2beb1e23c6cad8&vjs=3
Digital Sales (Marketing) Coordinator/Assistant,Katrina Sweets & Confectionary,Dubai,"Past experience in Food & Beverage and\\or Retail industry projects is an advantage.
To communicate with designer\\agency to update\\create the prices\\items\…",,2 days ago,https://ae.indeed.com/company/Katrina-Sweets/jobs/Digital-Sales-Coordinator-Assistant-f6ad61e5e8249356?fccid=ce8be34db6acc0b5&vjs=3
office helper,lookatmeprint.com,Sharjah,"Office assistant: 1 year (Preferred).
Printing help and cleaning of the printing floor.
Job Types: Full-time, Permanent.",,24 days ago,https://ae.indeed.com/company/lookatmeprint.com/jobs/Office-Helper-f29ec1315a2d63d7?fccid=c2cd88cb264c1335&vjs=3
ADMIN ASSISTANT,Real Estate Company - Dubai,Jebel Ali,"Previous experience in Office admin work preferred.
Job Types: Full-time, Permanent.
Office Admin: 2 years (Preferred).",,5 days ago,https://ae.indeed.com/company/White-Feather-Properties/jobs/Admin-Assistant-643fb050853bdb9f?fccid=43540221c9b4351e&vjs=3
Female Medical Receptionist,En Vogue Beauty Center,Dubai,"At least 3 full years of direct experience as a medical office receptionist in a fast-paced clinic, hospital, or similar healthcare setting.",,28 days ago,https://ae.indeed.com/company/En-Vogue-Beauty-Center/jobs/Female-Medical-Receptionist-c3a2b5796452b7b6?fccid=62866be454a31ed3&vjs=3
Front Desk Officer,Caremonde Day Surgical Center L.L.C,Dubai,"Arabic and English Speaker is mandatory.
Preferably can communicate in English as well.
As the receptionist, you will handle phone, social media, and face-to…",,3 days ago,https://ae.indeed.com/company/Caremonde-Day-Surgical-Center-L.L.C/jobs/Front-Desk-Officer-11af73c776ff1de9?fccid=65c520b3959e7319&vjs=3
Executive Assistant (Arabic Speaking/ German Speaking),SellAnyCar.com,Dubai,Ensure documents are filed in a systematic way and are readily available to the CEO when requested Manage external contacts and proactively understands who they…,,1 day ago,https://ae.indeed.com/rc/clk?jk=dd3d77a5077079b8&fccid=4a24448e569ea51e&vjs=3
Office Assistant cum clener,Usman Butt Electro Mechanical Services,Umm al-Quwain City,"Office asst cum clener have english or urdu hindi specking min high school have good flexable skills.
Job Types: Full-time, Permanent.",,14 days ago,https://ae.indeed.com/company/Usman-Butt-Electro-Mechanical-Services/jobs/Office-Assistant-Cum-Clener-5e61a8de32d751b3?fccid=96d88edb37b000e3&vjs=3
Real Estate Admin Assistant |Experienced in Brokerage Firm,Achiever Properties LLC,Dubai,"Administrative assistant: 1 year (Required).
Day-to-day operations include answering the telephone, taking messages, scheduling appointments.",,30+ days ago,https://ae.indeed.com/company/Achiever-Properties-LLC/jobs/Real-Estate-Admin-Assistant-Experienced-Brokerage-Firm-20d8397bce6b23af?fccid=650752aad9a870c9&vjs=3
Administrative Assistant cum Accountant,AST Plus Technical Services LLC,Dubai,"Ability to take office full responsibility.
Excellent written and spoken communication skills.
Excellent computer and administration skills.",,28 days ago,https://ae.indeed.com/company/AST-Plus-Technical-Services-LLC/jobs/Administrative-Assistant-Cum-Accountant-c038015a3faf66cb?fccid=5a3ed0c07ccb8b95&vjs=3
Property Consultant,Expert Properties,Dubai,"Administrative assistant: 2 years (Required).
Clear and Effective communication skills.
Creates a business to find buildings, projects, developments, apartments…",,26 days ago,https://ae.indeed.com/company/Expert-Properties/jobs/Property-Consultant-46d9c429db204ee5?fccid=4e1e74d80b7cf92b&vjs=3
Store Manager,Al Shamsi Holdings,Dubai,A Store Manager manages all activities necessary to the efficient operations of the store and provide prompt and courteous service to customers in order to…,,30+ days ago,https://ae.indeed.com/rc/clk?jk=84252cf7e597148e&fccid=836efa2cb13a9b23&vjs=3
Executive Administrator,Five Continent,Abu Dhabi,"Bachelor’s degree, MS office and training courses in Office Management & Administration.
Responsible for calendar management, requiring interaction with both…",,23 days ago,https://ae.indeed.com/company/Five-Continents-Technical-&-Industrial-Services-Est./jobs/Executive-Administrator-883f168c25763e2e?fccid=193555cfe31f98bc&vjs=3
Export & Logistics Coordinator,We Search 360,Dubai,"- Good command of MS Office - Excel.
You will be the point of contact for customers and sales team with queries about products, orders and deliveries as well…",,21 days ago,https://ae.indeed.com/company/We-Search-360/jobs/Export-Logistic-Coordinator-e212fb8296fe2ec7?fccid=1be79cb3a0e5b423&vjs=3
Operations Assistant - Shipping,KFS,Abu Dhabi,"Monitoring and circulating the weather forecast to the vessels and concerned departments.
Monitoring and reporting vessels positions and ROB’s to the concerned…",,7 days ago,https://ae.indeed.com/company/KFS/jobs/Operation-Assistant-d5b1ab1c8c2f1fd5?fccid=48e4ece2ec56a048&vjs=3
Office Assistant,Careers International,Abu Dhabi,"Job Types: Full-time, Permanent.",,8 days ago,https://ae.indeed.com/company/Careers-International/jobs/Office-Assistant-01d2e2ca9459b142?fccid=9164637f37d34300&vjs=3
Assistant Accountant cum Receptionist - Female Candidates Only,Sportland FZCO,Dubai,"Ensures knowledge of staff movements in and out of the office during office hours and maintaining a log sheet of the same.
Job Types: Full-time, Permanent.",,20 days ago,https://ae.indeed.com/company/Sportland-FZCO/jobs/Assistant-Accountant-Cum-Receptionist-6385dbe10c46c04c?fccid=d6ec4d7dc3d55526&vjs=3
Warehouse Assistant cum Scanning Operator,Back Office FZ LLC,Dubai,"Candidate should have knowledge about scanning, archiving, and documentation.
Candidates should be physically fit for manual work as the job role requires work…",,16 days ago,https://ae.indeed.com/company/XYZ/jobs/Warehouse-Assistant-Cum-Scanning-Operator-d0231cc2883aa1da?fccid=4973d08fa9c79d3e&vjs=3
Office Assistant - Russian Speaker (with Finance exp),Search & Select Management,Dubai,"Office administration: 2 years (Required).
With at least 3 to 5 years of experience in office administration.
Prepare administrative, financial and supply chain…",,11 days ago,https://ae.indeed.com/company/search-&-select-management/jobs/Office-Assistant-f87d77e1f053cda8?fccid=becb9370696b2af7&vjs=3
Admin Assistant/Receptionist,GHP Quality Consultants,Dubai,"Administrative assistant: 1 year (Preferred).
Provides general office support with a variety of clerical activities and related tasks.",,15 days ago,https://ae.indeed.com/company/GHP-Quality-Consultants/jobs/Admin-Assistant-Receptionist-a22cf32ac162e8e8?fccid=6095d87b420d0850&vjs=3
Personal Assistant cum Admin,Be Unique,Dubai,"Proven admin or assistant experience.
We have a requirement for a Superstar Female Personal Assistant cum Admin to join us on a full-time basis.",,21 days ago,https://ae.indeed.com/company/Be-Unique/jobs/Personal-Assistant-Cum-Admin-75dd27f0a062a0ff?fccid=12cd130a1470ff03&vjs=3
Administrator,Be Unique,Dubai,"Proven admin or assistant experience.
Excellent time management skills and ability to multitask and prioritize work.
Job Types: Full-time, Permanent.",,1 day ago,https://ae.indeed.com/company/Be-Unique/jobs/Administrator-f4fca499cd6760a1?fccid=12cd130a1470ff03&vjs=3
secretary cum digital marketing,BIN RASHID FURNITURE,Dubai,"Develop and implement office procedures.
Set up and oversee administrative policies and procedures for offices and/or organizations.",,4 days ago,https://ae.indeed.com/company/BIN-RASHID-FURNITURE/jobs/Secretary-Cum-Digital-Marketing-e13d1c77a212d3e4?fccid=200815417aedc4d6&vjs=3
Warehouse Assistant - Distribution,CAVALIER SHOES,Dubai,"Arrangement of loaded materials as per the Delivery Challan (DC) issued from office.
Preparing and completing warehouse orders for delivery or pickup according…",,30+ days ago,https://ae.indeed.com/company/CAVALIER-SHOES/jobs/Warehouse-Assistant-5a41d686d5ca13b2?fccid=7ea786f1c6861172&vjs=3
COMMERCIAL ASSISTANT - (MALE / FEMALE),Dynatrade,Dubai,"Job: Handling all commercial activities related to the sales & service business, including invoice generation & submission, payment follow-up, collection,…",,30+ days ago,https://ae.indeed.com/rc/clk?jk=34f886ad6e4c3199&fccid=e5927b2fecc44906&vjs=3
Office Secretary,Bionics Medical Equipments Trading LLC,Dubai,"Familiarity with office organization and optimization techniques.
Proven work experience as a secretary or administrative assistant.",,30+ days ago,https://ae.indeed.com/company/Bionics-Trading-FZE/jobs/Office-Secretary-af1e408530c3306b?fccid=902590eabf3b41db&vjs=3
Accounts Assistant cum Night Auditor,Grand Central Hotel,Dubai,"Assist in day to day finance operations and he / she is primarily responsible for computing, recording, collecting, analyzing and verifying numerical data for…",,29 days ago,https://ae.indeed.com/company/Grand-Central-Hotel/jobs/Account-Assistant-Cum-Night-Auditor-d1c5c3430ec7d267?fccid=f4e6c4fb0b1497bd&vjs=3
Office Correspondence Cum Accountant,SFS ENTERPRISE LLC....... DEIRA - DUBAI,Dubai,"Job Types: Full-time, Permanent.
Job Types: Full-time, Permanent.
Business Developments: 1 year (Preferred).
Business development: 1 year (Preferred).",,25 days ago,https://ae.indeed.com/company/SFS-ENTERPRISE-LLC/jobs/Office-Correspondence-Cum-Accountant-d7768d2ca09fe369?fccid=801a077c66efaf76&vjs=3
motorcycle driver plus office assistant female,CLASSIC EXPRESS DELIVERY SERVICES LLC,Dubai,"MOTOR BIKE RIDERS WITH VALID UAE MOTOR BIKE LICENSE.
Job Types: Full-time, Permanent.",,21 days ago,https://ae.indeed.com/company/CLASSIC-EXPRESS-DELIVERY-SERVICES-LLC/jobs/Motorcycle-Driver-Plus-Office-Assistant-Female-a3ee938047087109?fccid=e7584d39a6183fc2&vjs=3
Lady Accountant Cum Admin Executive,Customex,Dubai Free Zone,"Manage office supplies and purchasing.
Administrative assistant: 1 year (Preferred).
Handle office and employee governmental activities such as renewal of trade…",,30+ days ago,https://ae.indeed.com/company/Customex/jobs/Lady-Accountant-Cum-Admin-Executive-90cb19947eefc6d6?fccid=26bf32da245c4d9b&vjs=3
Administrative Assistant with Sales and SEO/Digital Marketing Experience,Home360,Dubai,"Administrative assistant: 1 year (Preferred).
Knowledge of facility management industry – maintenance/repairs of homes and offices.",,22 days ago,https://ae.indeed.com/company/Home360/jobs/Administrative-Assistant-Sales-SEO-Digital-Marketing-Experience-7cd6f73bfeed1fb7?fccid=3c1aabedca2be367&vjs=3
Personal Assistant to Real Estate Agent (AED 2K Only),Valorem Real Estate Brokers,Dubai,"Full understanding of Microsoft office.
At least 2 years previous experience as a personal assistant.
Looking for a talented personal assistant to a C-Level…",,28 days ago,https://ae.indeed.com/company/Valorem-Real-Estate-Brokers/jobs/Personal-Assistant-Real-Estate-Agent-b6f2a4850c8ad66b?fccid=dd616958bd9ddc12&vjs=3
Operations Assistant - Temporary (Own Visa),Ultimate HR Solutions,Dubai,"Operates office equipment in terms of photocopying and scanning.
One of the government entities in Dubai is currently looking to hire Operations Assistant …",,7 days ago,https://ae.indeed.com/company/Ultimate-HR-Solutions/jobs/Operation-Assistant-68e288966f241773?fccid=c45627dbd85626d8&vjs=3
Assistant Manager (Female; Russian Speaker),ST GROUP,Dubai,"Required: Accounting Background experience, office work experience*.
Stone Tree Vacation Homes provides property management services to owners and investors and…",,29 days ago,https://ae.indeed.com/company/ST-GROUP/jobs/Assistant-Manager-5496994dbb1f6f08?fccid=8e12247b2c2a45f7&vjs=3
Female Russian Sales Assistant and Receptionist,LUXURY ANTONOVICH DESIGN,Dubai,"Direct visitors to the appropriate person and office.
Keep updated records of office expenses and costs.
Order front office supplies and keep inventory of stock…",,5 days ago,https://ae.indeed.com/company/Luxury-ANTONOVICH-Design/jobs/Female-Russian-Sales-Assistant-Receptionist-7896c5fe6c6177f0?fccid=4926eafa0a2f522c&vjs=3
Driver cum Assistant,Sea Shell Shop Materials Trading LLC,Dubai,"Picking up office purchases or other administrative needs.
They must help the company with any other assistant tasks given by the management.",,22 days ago,https://ae.indeed.com/company/Sea-Shell-Shop-Materials-Trading-LLC/jobs/Driver-Cum-Assistant-dfb492e86f7923d0?fccid=47233188711820d6&vjs=3
Executive Assistant,Mimo,Dubai,"Supporting Chief Executive Officer and C-level executives on daily business.
Supporting executive in preparing for meetings.",,30+ days ago,https://ae.indeed.com/rc/clk?jk=94b131dda81a7026&fccid=d0f6ed4f30765178&vjs=3
Sales & Pricing Coordinator,We Search 360,Dubai,"Good command of MS Office.
Experience in Pricing / Product / Supply & demand.
Excellent communication skills, including writing, proof reading, and speaking.",,Just posted,https://ae.indeed.com/company/We-Search-360/jobs/Sales-Pricing-Coordinator-f3070da52c127b85?fccid=1be79cb3a0e5b423&vjs=3
Assistant Financial Controller (Joinery & Fitout),ANOC,Ajman,"Proven experience as assistant controller or other similar position.
Support most aspects of accounting management (AP/AR, reporting etc.).",,30+ days ago,https://ae.indeed.com/rc/clk?jk=e9db825ca041eacd&fccid=9b78c219bdf39d2f&vjs=3
"Site Accounting Assistant in Dubai, UAE",Omni International,Dubai," Bachelor's Degree in Accountancy.
 Preferably Certified Public Accountant and ACCA qualified.
 Solid Knowledge and Experience in General Accounting and VAT.",,30+ days ago,https://ae.indeed.com/rc/clk?jk=5840995000ef49ba&fccid=eb525ce63ed76336&vjs=3
Marketing and Sales Coordinator (Tagalog Speaking ),careersbay,Dubai,"Minimum 4-6years experience having worked in sales or marketing department in any industrial/commercial industry, preferable in the HVAC aftermarket.",,21 days ago,https://ae.indeed.com/company/careersbay/jobs/Marketing-Sales-Coordinator-2cee9045ffd3f433?fccid=5613ef16683d8fa5&vjs=3
Light Vehicle Driver,R S K SECURITY SERVICES,Dubai,Looking for office assistant cum driver main job responsibilities are staff pick and drop from sites and some office routine work.,,26 days ago,https://ae.indeed.com/company/R-S-K-SECURITY-SERVICES/jobs/Light-Vehicle-Driver-b9004793ec13e51c?fccid=c1983eae1e4b9c3b&vjs=3
HR & Administrative Assistant - Arabic/French Speaker,Vertex Consulting,Dubai,"Keep a record of all official documents concerned with the company’s offices (.
Supervisor & Director will elaborate on the company’s human resources strategy…",,21 days ago,https://ae.indeed.com/company/Vertex-Consulting/jobs/Human-Resource-Administrative-Assistant-0ed03e7012adb4f7?fccid=378f3c78067a7cd9&vjs=3
Nursery Nurse,Jumeriah International Nurseries - Dubai,Dubai,"This position would involve performing the duties of a teaching assistant in a class.
Qualified Female Nursery Nurse aged 25-45 years.",,5 days ago,https://ae.indeed.com/company/Jumeriah-International-Nurseries---Dubai/jobs/Nursery-Nurse-4b119b6b883c5bc8?fccid=26791c03a4225b37&vjs=3
French Bread Baker,Leading Bakeries,Dubai,The main purpose of the Head Baker position is to oversee the preparation and service of all baked goods (European breads and country breads) for small and…,,8 days ago,https://ae.indeed.com/company/Leading-Bakeries-LLC/jobs/French-Bread-Baker-4b7c6f0de897eb7a?fccid=d6205b7411f14351&vjs=3
ASSISTANT ACCOUNTANT,Right Search HR Consultancy,Abu Dhabi,"Bachelor’s Degree in Accounting or any related course.
Minimum of 2 years’ experience.
Expert knowledge in data entry and Microsoft Office.",,22 days ago,https://ae.indeed.com/company/Right-Search-HR-Consultancy/jobs/Assistant-Accountant-0d756348bedc4bd1?fccid=57c734b80614c8d4&vjs=3
Marketing Assistant (FEMALE ONLY - GERMAN SPEAKER PREFERRED),Iconic Middle East Ltd.,Dubai International Financial Center,"Formulating marketing strategies and plans.
Responsible for promotion activities and publicity work.
Using of various promotion methods and rules in social…",,10 days ago,https://ae.indeed.com/company/Iconic-Middle-East-Investment/jobs/Marketing-Assistant-01a4998b7d3a046c?fccid=ca4314419a6d3ead&vjs=3
Female Pelvic and Reconstructive Surgeon,Search Plus HR,Remote,"If maintaining a private office, hire and supervise administrative and medical staff, and oversee finances;
Meet with a patient to learn complaints, symptoms,…",,4 days ago,https://ae.indeed.com/rc/clk?jk=9bc680687328f00a&fccid=618066ca5559b1d4&vjs=3
Digital Marketing Specialist,Seolane,Dubai,"2️⃣ Training will be: 6 to 12 months in Georgia, then the position will be opened in Dubai and/or Abu Dhabi.
- Main missions: *Online & Offline Marketing.",,5 days ago,https://ae.indeed.com/company/Seolane/jobs/Digital-Marketing-Specialist-e4676f16e2043e53?fccid=f08c4433b1d992b9&vjs=3
Administrative Assistant,Nationwide Middle East Properties LLC,Dubai,"Maintain and order office supplies.
Administrative assistant: 1 year (Preferred).
Experience in Crm/Zoho/Prop space/ listings/handling reception/familiar Ejari…",,Just posted,https://ae.indeed.com/company/Nationwide-Middle-East-Properties-LLC/jobs/Administrative-Assistant-b6ddf9bf68312b79?fccid=c6b7cdaa06fc859e&vjs=3
Office Secretary,Modern Interior Technology,Dubai,"Familiarity with office organization and optimization techniques.
Check frequently the levels of office supplies and place appropriate orders.",,Today,https://ae.indeed.com/company/Modern-Interior-Technology/jobs/Office-Secretary-c7f82a1178780e6e?fccid=2b1dda0cc43936cb&vjs=3
HR Assistant,Gettech Software Solutions,Dubai,The ideal candidate will support the full scope of Human Resources responsibilities and partner with the organization on strategic initiatives.,,Today,https://ae.indeed.com/company/Gettech-Software-Solutions/jobs/Human-Resource-Assistant-2cb6b91633af6d9e?fccid=dd616958bd9ddc12&vjs=3
Office Assistant / Office Boy,Trovec Management Consultancy,Dubai,"Coordinate activities and disseminate information to office staff.
Operate office equipment such as photocopiers and fax machines and related Items.",,Today,https://ae.indeed.com/company/Trovec-Management-Consultancy/jobs/Office-Assistant-a60365babc879d6c?fccid=30ea59f4c9f72189&vjs=3
Receptionist / Admin Assistant,canadian veterinary clinic,Abu Dhabi,"The ideal candidate is a detail-oriented team player who will be the first point of contact for visitors at the office, greeting them in a polite and well…",,Today,https://ae.indeed.com/company/canadian-veterinary-clinic/jobs/Receptionist-c6227faa1ef3ef3b?fccid=37bfe6667ac0eed1&vjs=3
Office Assistant / Office Boy,Bin Shabib Group,Dubai,"Office aide: 1 year (Preferred).
Maintain the general cleanliness of the office and meeting room.
Basic administrative duties, such as serving beverages to the…",,Today,https://ae.indeed.com/company/BIN-SHABIB-GROUP/jobs/Office-Assistant-d563353bf127ff11?fccid=7af69610defd1068&vjs=3
Receptionist,Sports and Fitness,Dubai,"Willingness and ability to occasionally work outside normal office hours.
She shall also assist internal and external customers of the club by handling office…",,Today,https://ae.indeed.com/company/Sports-and-Fitness/jobs/Receptionist-da4461f750c003e2?fccid=f1de43e02279c6bc&vjs=3
Office Assistant / Office Boy,DAS Collection LLC,Dubai,"Office assistant: 1 year (Preferred).
Make sure the office & production premise is clean.
Responsible for removing trash in office areas and non-production…",,Today,https://ae.indeed.com/company/DAS-Collection-LLC/jobs/Office-Assistant-2f66e1e343fb4f96?fccid=b2b9c3d4194af2aa&vjs=3
Office Assistant,CBD Accounting & Tax Consultant,Dubai,"Proven experience as office assistant or in another relevant administrative role.
Working knowledge of office equipment.
Job Types: Full-time, Contract.",,1 day ago,https://ae.indeed.com/company/CBD-Accounting-&-Tax-Consultant/jobs/Office-Assistant-70d74a04e2df3e20?fccid=8b7c83314dfc6b2b&vjs=3
EXECUTIVE SECRETARY CUM OFFICE ASSISTANT,LS DESIGN,Dubai,"Ensures adequate supplies for stationary, equipment and pantry supplies for the office.
Management of company email, coordination and correspondence to…",,1 day ago,https://ae.indeed.com/company/LIGHT-SPACE-DESIGN/jobs/Executive-Secretary-Cum-Office-Assistant-721ab46d7784eb47?fccid=dc61dc3398112fbb&vjs=3
HR & Admin Assistant,Nadia Global,Abu Dhabi,"Leave Entitlements and Leave settlement.
Working Experience - 5-10 Years work experience in HR Department.
Qualification - Bachelor in HR or Diploma in HR.",,1 day ago,https://ae.indeed.com/company/Nadia-Global/jobs/Human-Resource-Admin-Assistant-3a08e6d2927360f6?fccid=ec74626bafb37b24&vjs=3
Administrative Assistant Female,Oasis Metal Manufacturing LLC,Dubai,"Administrative assistant: 2 years (Preferred).
Working closely with the team and provide support.
To produce letters, reports and other documents as required…",,1 day ago,https://ae.indeed.com/company/Oasis-Metal-Manufacturing-LLC/jobs/Administrative-Assistant-Female-bb2131ebfd128d7a?fccid=4f711be251ed6182&vjs=3
"Admin Assistant / Accounts Receivable (Pilipino, Female only)",Hydro Water Sport,Dubai,"Is in charge of all Administration works of the Department, and organizes as much as possible the clerical procedures to facilitate The Finance Department day…",,1 day ago,https://ae.indeed.com/company/Hydro-Water-Sport/jobs/Admin-Assistant-4a76a68feae10e28?fccid=78033164d764133a&vjs=3
