JobTitle,Company,Location,Salary,PostDate,Summary,JobUrl
Reference Technician,Zayed University,Abu Dhabi,"The Reference Technician will provide effective support at the reference desk to assist students, faculty and staff in locating appropriate information…",,30+ days ago,https://ae.indeed.com/rc/clk?jk=e885c919c47e1e91&fccid=9628b0bd10bde506&vjs=3
Assistant Technician - FM Civil & Furniture /Polisher,Serco Group,Dubai,"The purpose of the role is to carryout preventative, corrective and breakdown maintenance on civil works individually or as part of a technical team, within a…",,5 days ago,https://ae.indeed.com/rc/clk?jk=af88dabf8e4fb21d&fccid=8177021cdb259d9d&vjs=3
Corporate Lifestyle Manager (Dubai office),Jobsite Direct,Dubai,"Our Members are based around the globe, and place a variety of lifestyle & leisure-related requests for assistance with our Lifestyle Management team.",,30+ days ago,https://ae.indeed.com/rc/clk?jk=c09632cad53ac16f&fccid=3e2ac6fc889f26fe&vjs=3
"Assistant Dean, Residential Education and Community Standards - Campus Life (Fixed-Term for 3 Years)",NYU Abu Dhabi,Abu Dhabi,Work alongside the six other assistant or associate deans in Campus Life to provide one-on-one support and mentorship to individual students in an advising…,,30+ days ago,https://ae.indeed.com/rc/clk?jk=19894a8b697c8916&fccid=1fd02f11432a270f&vjs=3
Sales Executive,felixpharma,Dubai,"Should also provide a personal assistant role to the General Manager.
Arabic lady with family sponsorship will be preferred.",,19 days ago,https://ae.indeed.com/rc/clk?jk=c5069b72bed9c4b4&fccid=9642a090ce9cd051&vjs=3
Housekeeping Supervisor - Female,Mandarin Oriental Hotel Group,Dubai,"It is part of your role and your responsibility to fully support all learning and development activities.
Inspect, check and release hotel rooms for arrivals in…",,7 days ago,https://ae.indeed.com/rc/clk?jk=710991f206c61c1c&fccid=0b0d7dbf16a42062&vjs=3
Executive Assistant,CharterHouse,Dubai,You will also be involved within office operations and will support on adhoc administrative projects where required.,,30+ days ago,https://ae.indeed.com/rc/clk?jk=1e0a6a3eda5bcb53&fccid=b83c25ae21a976ae&vjs=3
Assistant for Speaker / Mentor in Finance / Economic Industry,Prime Tech,Dubai,Collaborate with management to identify training needs for corporate training partners - Schedule appropriate training sessions.,,30+ days ago,https://ae.indeed.com/rc/clk?jk=11d6604acabc4d38&fccid=ab1475f17886abc7&vjs=3
Doctors,Ferapeat Global Recruitment,UAE,"Nurses with Bachelor or Diploma Degree.
For applying, candidates have to qualified DHA, HAAD, Prometric and Dataflow certificate is mandatory as per the…",,30+ days ago,https://ae.indeed.com/rc/clk?jk=96dc85aca399abfc&fccid=d0544e84fcacd8be&vjs=3
Assistant to Director,Jobsite Direct,Dubai,"To provide a highly confidential approach at all times.
Management of the diary and hospitality services to ensure a professional and organised approach at all…",,30+ days ago,https://ae.indeed.com/rc/clk?jk=c1205ad8d5b0987a&fccid=3e2ac6fc889f26fe&vjs=3
Senior Student Success Officer,American University of Ras Al Khaimah,Ras al-Khaimah,"Reporting to the Associate/Assistant Provost for Student Success, the person in this position coordinates all services within the Center for Learning Support…",,30+ days ago,https://ae.indeed.com/rc/clk?jk=7ee0c313cddbb925&fccid=406f6ced1bb42efd&vjs=3
Assistant Product Manager,Ignite Search & Selection,Dubai,"Candidate requirements • Be able to demonstrate a high level of multitasking efficiency & priority setting • Ability to read, analyze and interpret data studies…",,26 days ago,https://ae.indeed.com/rc/clk?jk=f9178b6d80c8533d&fccid=6f32a9b2442a4e4b&vjs=3
Residential College Operations Manager - Campus Life (Fixed Term for 3 years),NYU Abu Dhabi,Abu Dhabi,"Maintain and distribute datasets and rosters to staff and offices as needed.
Assess and determine required occupancy needs in alignment with room inventory and…",,30+ days ago,https://ae.indeed.com/rc/clk?jk=f20d87107d17aece&fccid=1fd02f11432a270f&vjs=3
Assistant Professor in Information Technology,Al Khawarizmi International College,UAE,"Provide students with academic advising during the registration period, constantly monitor their study plans and adhere to office hours.",,15 days ago,https://ae.indeed.com/rc/clk?jk=4f3881d41d62bc8f&fccid=e5e4309ec04ef187&vjs=3
Assistant General Counsel (UK & ME),Black Pearl Consult,Dubai,"Managing the effective compliance of the all ME offices, reporting directly to the Managing Partners of those offices and designing with the GC effective…",,30+ days ago,https://ae.indeed.com/rc/clk?jk=dee1494463f9275b&fccid=e9d731aa91b2d791&vjs=3
Executive Assistant - Emirati National,Swisslinx,Dubai,"Ad hoc administrative task include calendar management, travel booking, office management, meeting and event preparation, email correspondence as well as…",,18 days ago,https://ae.indeed.com/rc/clk?jk=9e9ef7bf182be6df&fccid=aa0d17f5e4fc301b&vjs=3
Administration & Customer Engagement,Plum Jobs,Dubai,"Administration roles are diminishing in well-structured organizations and to lower their headcount and payroll costs, we are working with our clients to recruit…",,30+ days ago,https://ae.indeed.com/rc/clk?jk=30b572ddbf79a0db&fccid=f6bdce6d1e14255f&vjs=3
Back Office Medical Assistant,JAMS HR Solutions,Sharjah,"Obtaining chief complaint and vitals.
Point of care testing, collection, labeling, and handling of specimens, logging patient demographic and visit information.",,30+ days ago,https://ae.indeed.com/rc/clk?jk=181c0f42ebe85009&fccid=5995a0f63c4fddb1&vjs=3
Protective Coatings (PC) Sales Engineer,SIGMA PAINTS,Abu Dhabi,"To establish contact and build a relationship with existing and new customers in the area to achieve the set budget.
8-10 years of experience in PC business.",,30+ days ago,https://ae.indeed.com/rc/clk?jk=28a0e6f416954b92&fccid=b1aa96c837dbf522&vjs=3
مساعـد أسنان جانبي 1,هيئة الصحة بدبي,Dubai,"Provide guidance and supervision to other dental assistants as appropriate.
Arranges appointments, receive and dismiss patients, keep and maintain patient's…",,6 days ago,https://ae.indeed.com/rc/clk?jk=e32d76a8b8539cc1&fccid=c166edb940e38c8e&vjs=3
Personal Assistant to a VVIP,Black Pearl Consult,Abu Dhabi,"Liaise with Company’s Advisors, Royal Offices and Ambassador offices and liaise with the female advisors on the Royal Balcony.",,30+ days ago,https://ae.indeed.com/rc/clk?jk=e4b8261b1a0b9d7f&fccid=e9d731aa91b2d791&vjs=3
Research Assistant - Grant,United Arab Emirates University (UAEU),Al-Ayn,"Job Description Research Assistant position with the psychiatry department.
The post holder will be based at the College of Medicine and Health Sciences at the…",,30+ days ago,https://ae.indeed.com/rc/clk?jk=32e5e4f0665743e6&fccid=b41c0daaeee4e303&vjs=3
Dental Nurse / Dental Assistant,Medicentres,Dubai,"Provide chair-side assistance to dentists and/or dental hygienists in the performance of dental procedures, to include operative, preventive, periodontal,…",,30+ days ago,https://ae.indeed.com/rc/clk?jk=4365766c5f955d1f&fccid=c3a14a8c9902e4eb&vjs=3
Team Assistant,Black Pearl Consult,Sharjah,"Administer the purchasing of office supplies and equipment.
Very professional and smart — must be able to interact clearly, confidently and politely with very…",,30+ days ago,https://ae.indeed.com/rc/clk?jk=d640ffdde42600c6&fccid=e9d731aa91b2d791&vjs=3
Assistant Front Office Manager,WHR Solution,Abu Dhabi,"As Assistant Front Office Manager, you will be responsible in supervising the Front Office Team to ensure that Team Members are prepared and well-informed to…",,30+ days ago,https://ae.indeed.com/rc/clk?jk=2c545f97fde2a39b&fccid=0b6ceee04f9ad27c&vjs=3
Registrar (Abu Dhabi),EOS Recruitment,Abu Dhabi,"This role may require occasional work outside of normal office hours.
Processes requests for or inquiries on registration information, procedures, and/or…",,30+ days ago,https://ae.indeed.com/rc/clk?jk=8c80e6e7e2af81c6&fccid=14281968e41db56d&vjs=3
Assistant Technician - Chillers & Plants (Electrical) - this role is with our outsourcing partner Serco,Dubai Airports,Dubai,"The purpose of the role is to carryout preventative, corrective and breakdown maintenance on chiller and low voltage power related systems and assets…",,30+ days ago,https://ae.indeed.com/rc/clk?jk=664ec552a13ee834&fccid=b1b72a0873ccea59&vjs=3
Fabrication Engineer (shipyard),WTS Energy,Dubai,"Possess knowledge of MS office, Mariner application and Project Management skills.
Plan, organize, coordinate and supervise Fabrication activities including…",,27 days ago,https://ae.indeed.com/rc/clk?jk=db56d07e6dc2ab52&fccid=06f79b13e7ee7f0a&vjs=3
Nursery Nurse,Fortes Holdings,Dubai,Or moreThis position would involve performing the duties of a teaching assistant in a classNursery or school experience would.,,30+ days ago,https://ae.indeed.com/rc/clk?jk=78a416cb4762719f&fccid=aa2fdf0cddbb8233&vjs=3
Corporate Counsel - Development,"Marriott International, Inc",Dubai,"This position will be located in Marriott International’s office in Dubai and will report to the VP & Assistant General Counsel.
Fluency in Arabic is preferred.",,30+ days ago,https://ae.indeed.com/rc/clk?jk=54bb364182960c2c&fccid=d47acb5b5596d9e4&vjs=3
ALSS Senior Engineer - Pump Mechanics,Farah Experiences,Abu Dhabi,The ALSS (Animal Life Support Systems) Engineers and Technicians in carrying out the tasks related to ALSS; thus directly impacting the health and safety of…,,19 days ago,https://ae.indeed.com/rc/clk?jk=b422132dd103d4ed&fccid=928854a9391cd3bb&vjs=3
Senior Projects Lawyer,Clifford Chance LLP,Dubai,"Our clients include public and private corporations, investment banks and financial institutions, governments and international bodies.",,6 days ago,https://ae.indeed.com/rc/clk?jk=a1f0aaea46a56d05&fccid=b86b23baf1e359f5&vjs=3
ALSS Senior Engineer - Systems Automation,Farah Experiences,Abu Dhabi,The ALSS (Animal Life Support Systems) Engineers and Technicians in carrying out the tasks related to ALSS; thus directly impacting the health and safety of…,,19 days ago,https://ae.indeed.com/rc/clk?jk=a1b1307038654485&fccid=928854a9391cd3bb&vjs=3
Assistant Professor in Accounting,Al Khawarizmi International College,UAE,"Provide students with academic advising during the registration period, constantly monitor their study plans and adhere to office hours.",,21 days ago,https://ae.indeed.com/rc/clk?jk=48d79536de19c2c9&fccid=e5e4309ec04ef187&vjs=3
Assistant Officer,Julphar,Ras al-Khaimah,Job Title: Assistant Officer Division: Research & Development - Analytical Country: UNITED ARAB EMIRATES Work Location: UAE (RAK head office) Job Type:…,,30+ days ago,https://ae.indeed.com/rc/clk?jk=00d1267c01b92e7a&fccid=02ea1bee6fdc4b67&vjs=3
Company Secretary,Talent Zone Consultants,Dubai,Secretary / customer support (Female) Salary - 5000 Dhirams Experience Fresher Salary 10 Lac To 11 Lac P.A. Industry Front Office / Reception/Computer…,,30+ days ago,https://ae.indeed.com/rc/clk?jk=984e0ea266da914b&fccid=b59e1dacbb0cb645&vjs=3
ALSS Senior Engineer - Filtration Mechanics,Farah Experiences,Abu Dhabi,In this role you will ensure a smooth and efficient operations of the SeaWorld Abu Dhabi facilities in Zoological Department by leading the ALSS (Animal Life…,,19 days ago,https://ae.indeed.com/rc/clk?jk=caff3b22b309a250&fccid=928854a9391cd3bb&vjs=3
Assistant Housekeeping Manager,"Marriott International, Inc",Dubai,"Inspect guest rooms, public areas, pool, etc. after being cleaned by Housekeeper to ensure quality standards.
Communicate issues to next shift.",,18 days ago,https://ae.indeed.com/rc/clk?jk=2865ea6a973236d1&fccid=d47acb5b5596d9e4&vjs=3
Pharmacist,Ferapeat Global Recruitment,UAE,"Nurses with Bachelor or Diploma Degree.
For applying, candidates have to qualified DHA, HAAD, Prometric and Dataflow certificate is mandatory as per the…",,30+ days ago,https://ae.indeed.com/rc/clk?jk=120c0e1788f2d387&fccid=d0544e84fcacd8be&vjs=3
Assistant Technician - FM Civil & Furniture - Carpenter - this role is with our outsourcing partner Serco,Dubai Airports,Dubai,"The purpose of the role is to carryout preventative, corrective and breakdown maintenance within a facilities management civil works section, individually or as…",,30+ days ago,https://ae.indeed.com/rc/clk?jk=c4752aaa557dbbab&fccid=b1b72a0873ccea59&vjs=3
Housekeeping Room Attendant,WHR Solution,Fujairah,"? Ensure that all keys, equipment and records are returned to the Housekeeping office.
Nestled between the foothills of the Hajar Mountains and the glistering…",,30+ days ago,https://ae.indeed.com/rc/clk?jk=54c44671daa92f8a&fccid=0b6ceee04f9ad27c&vjs=3
OB-GYN,Black Pearl Consult,Dubai,"Coordinate with other hospital or office staff, including nurses, specialists, and assistants.
Care for and treat women during and after pregnancy and…",,30+ days ago,https://ae.indeed.com/rc/clk?jk=f2de768668f5c7c1&fccid=e9d731aa91b2d791&vjs=3
Spa Receptionist,"Marriott International, Inc",Dubai,"Be responsible for access control, daily sales and guests needs i.e. locker keys, towel and bookings.
Update all reports and databases as needed.",,19 days ago,https://ae.indeed.com/rc/clk?jk=4fbe2c973eb50b75&fccid=d47acb5b5596d9e4&vjs=3
Assistant Professor/Program Leader,Al Khawarizmi International College,UAE,"Provide students with academic advising during the registration period, constantly monitor their study plans and adhere to office hours.",,21 days ago,https://ae.indeed.com/rc/clk?jk=5ce4ba9038c37f94&fccid=e5e4309ec04ef187&vjs=3
Assistant Professor in Respiratory Care,Al Khawarizmi International College,UAE,"Provide students with academic advising during the registration period, constantly monitor their study plans and adhere to office hours.",,21 days ago,https://ae.indeed.com/rc/clk?jk=2d730516edbd68e6&fccid=e5e4309ec04ef187&vjs=3
Office Assistant,Oasis Investment Company LLC - Al Shirawi Group,Dubai,"Preparation of LPO in oracle.
Job tracker entry, follow up & update the tracker.
Preparing, updating the tracker and filing of payment certificates.",,7 days ago,https://ae.indeed.com/company/Oasis-Investment-Company-LLC---Al-Shirawi-Group/jobs/Office-Assistant-27b924c3c8d292f0?fccid=165e1b400dd4179d&vjs=3
Office Support Assistant,Infotech For Employment Sole Proprietorship LLC,Abu Dhabi,"Requisitions, maintains and distributes office stationery and supplies.
Includes receiving people coming into the office of assigned Division Manager, answering…",,7 days ago,https://ae.indeed.com/company/Infotech-For-Employment-Sole-Proprietorship-LLC/jobs/Office-Support-Assistant-02dbbb5e35a63669?fccid=9d2e3e618088f76f&vjs=3
Office Assistant,Rons Enviro care LLC,Dubai,Candidates with hands on experience in MS Office applications and with good communication skills in English and able to work with dedication are required to…,,5 days ago,"https://ae.indeed.com/company/Rons-Enviro-Care,fm/jobs/Office-Assistant-8260ece3eab53d4d?fccid=7210b3bf55832ad8&vjs=3"
ADMIN ASSISTANT FOR A REPUTED CONSTRUCTION COMPANY IN ABU DHABI,DEOW INTERNATIONAL,Abu Dhabi,"Update and maintain office policies and procedures.
Order office supplies and research new deals and suppliers.
Answer and direct phone calls.",,13 days ago,https://ae.indeed.com/company/deow-international/jobs/Admin-Assistant-Reputed-Construction-Company-ba16da4b026f21d2?fccid=721aee27563053ca&vjs=3
Office Assistant,NewStar Property Management,Abu Dhabi,"Proven experience as a back-office assistant, office assistant, virtual assistant, or in another relevant administrative role.
Job Types: Full-time, Contract.",,1 day ago,https://ae.indeed.com/company/Newstar-Property-Management/jobs/Office-Assistant-55b4464085c92aec?fccid=e232fdb6f3697caf&vjs=3
Administrative Assistant,Divinity target consultancy services Inc,Dubai,"We provide every employee with the sanitary masks, we check body temperature every day in the office.
1.The candidate must be 21-35 years old.",,7 days ago,https://ae.indeed.com/company/Divinity-target-consultancy-services-Inc/jobs/Administrative-Assistant-65e9fe4235588969?fccid=81914c989acbc959&vjs=3
Office Assistant / Office Boy,GREEN AUTOWORKS,Dubai,"Maintain office cleanliness at all times.
Office aide: 1 year (Preferred).
Prepare and serve Tea / Coffee or water as requested.",,6 days ago,https://ae.indeed.com/company/Green-Autoworks/jobs/Office-Assistant-b05470cc4e67b1df?fccid=bc31ab4f90b917e8&vjs=3
Female Office assistant,soukchic,Dubai,"Proven experience as an office administrator, office assistant or relevant role.
The tasks of the office administrator will include bookkeeping and mentoring…",,13 days ago,https://ae.indeed.com/company/ALTA-TECH-DWC-LLC/jobs/Female-Office-Assistant-62533a3e27263a31?fccid=3f477267445bfa3f&vjs=3
Office Administrator,PEROrient Building Contracting LLC,Dubai,"Coordinate repairs to office equipment.
Provide administrative support to ensure efficient operation of the office.
Answer and direct phone calls.",,16 days ago,https://ae.indeed.com/company/PEROrient-Building-Contracting-LLC/jobs/Office-Administrator-334d991ad2a4963c?fccid=92717fd0e9d9575d&vjs=3
Administrative Assistant,R K Property Real Estate Broker,Dubai,"Coordinates for office supply acquisitions and procures upon approval.
Supervising and monitoring the work of administrative staff and managing office-related…",,6 days ago,https://ae.indeed.com/company/R-K-Property-Real-Estate-Broker/jobs/Administrative-Assistant-16e3efe4e2b936e1?fccid=026ebc47f6a6f2d1&vjs=3
Office Assistant / Office Boy,Al Jawal Contracting,Dubai,"Office assistance: 1 year (Preferred).
Provide all routine of work Office Boy.
Assist to Secretary to filing documentation.",,30+ days ago,https://ae.indeed.com/company/Al-Jawal-Contracting/jobs/Office-Assistant-ae53891ce1fea648?fccid=29f182e829802528&vjs=3
Administrative Assistant,Biskom International DMCC,Dubai,"Taking all calls coming to the office and directing to the correct colleagues.
Supporting sales and procurement by preparing price lists / quotation lists /…",,15 days ago,https://ae.indeed.com/company/Biskom-International-DMCC/jobs/Administrative-Assistant-8ef6f3e1636318b7?fccid=aa5ffb1fb2620aee&vjs=3
Office Girl,NCSF NATIONAL CATERING AND FOODSTUFF LLC,Abu Dhabi,"Arranging meeting room and personal office.
Inter office information and the messenger job.
Office Girl shall provide adequate supplies and services for all…",,6 days ago,https://ae.indeed.com/company/NCSF/jobs/Office-Girl-68a2554395bc291d?fccid=fcdc8c3e683b38db&vjs=3
Office Assistant / Office Boy,London American City College,Sharjah,"Office aide: 1 year (Preferred).
Kindly Apply with complete CV and Visa Status.
Job Types: Full-time, Contract, Permanent.",,30+ days ago,https://ae.indeed.com/company/London-American-City-College/jobs/Office-Assistant-2d0f550d38f1b3d8?fccid=96b3838f8db08ca0&vjs=3
Office Assistant,Wood & Steel Furnitures - Dubai,Sharjah,"Ensure smooth and professional office operations.
Manage office supplies stock and place orders.
Office assistant: 5 years (Required).",,8 days ago,https://ae.indeed.com/company/Wood-&-Steel-Furnitures/jobs/Office-Assistant-2f723e64cb18297e?fccid=ca44047bc5b464d1&vjs=3
Personal Assistant,Rise,Dubai,"Organize and schedule meetings and appointments.
Produce and distribute correspondence memos, letters, faxes and forms.
Develop and maintain a filing system.",,21 days ago,https://ae.indeed.com/company/Rise/jobs/Personal-Assistant-17c9fc7d69ced856?fccid=d3cc26a925f7e4a4&vjs=3
Office Assistant / Office Boy,Lectera,Dubai,"Supervise any repairs/renovation occurring in the office.
Assistance during the preparation for events in the office.
Replace the water in the cooler.",,8 days ago,https://ae.indeed.com/company/Lectera/jobs/Office-Assistant-d84940f2188ba081?fccid=770722e35672ae38&vjs=3
Receptionist / Admin Assistant,JS,Jebel Ali Freezone,"Responsible for handling the office reception & admin duties.
Direct visitors to the appropriate person and office.
Job Types: Full-time, Contract.",,7 days ago,https://ae.indeed.com/company/JSME/jobs/Receptionist-277eabe27dcf69a5?fccid=da8272e9d3d86f31&vjs=3
Assistant Front Office Manager,Millennium Al Rawdah ( Abu Dhabi ),Abu Dhabi,"Prepare performance reports related to front office.
Participates in the selection of front office personnel.
Evaluates the job performance if each front office…",,9 days ago,https://ae.indeed.com/company/Millennium-Al-Rawdah-(-Abu-Dhabi-)/jobs/Assistant-Front-Office-Manager-6e84adb4183ca3ce?fccid=94ef41ec9b0561ae&vjs=3
Office Assistant,Padra Clinic,Dubai,"- Resolve office-related malfunctions and respond to requests or issues*.
We are looking for a competent Office Assistant to help with the organization and…",,25 days ago,https://ae.indeed.com/company/Padra-Medical-center/jobs/Office-Assistant-26417c2a4c165681?fccid=8aec848e2d7680bb&vjs=3
Office Assistant,International Gas Services Est,Abu Dhabi,A suitable candidate must have good English communication skills and willing to join immediately.,,1 day ago,https://ae.indeed.com/company/International-Gas-Services-Est/jobs/Office-Assistant-0c6f5defc26554ff?fccid=9785d463e40aa06b&vjs=3
Admin Assistant / Coordinator,Image Advertising L.L.C.,Abu Dhabi,"Working knowledge of common office equipment (e.g. optical scanner).
Experience with the use of MS Office applications, “back-office” and accounting software.",,15 days ago,https://ae.indeed.com/company/image-advertising/jobs/Admin-Assistant-b3edcdd4ed47182f?fccid=755706cc9704b3d6&vjs=3
Uniforms Products & Service Delivery Supervisor,Action Hospitality (ACH),Sharjah,"To assist in every stage of the uniform process ensuring consistent quality from initial design concept, development, manufacturing, stock management and wearer…",,30+ days ago,https://ae.indeed.com/rc/clk?jk=e8e3541771572dc4&fccid=dd616958bd9ddc12&vjs=3
Assistant Technician - FM Civil & Furniture/ Joinery- this role is with our outsourcing partner Serco,Dubai Airports,Dubai,"Various types of office furniture.
The purpose of the role is to carryout preventative, corrective and breakdown maintenance within a civil works workshop…",,30+ days ago,https://ae.indeed.com/rc/clk?jk=76644e2924afb6e2&fccid=b1b72a0873ccea59&vjs=3
Office Assistant / Office Boy,ITC FZE,Dubai,"Office boy: 3 years (Preferred).
Other remarks : Presentable, Pleasing personality, ready for office cleaning works, & available in UAE , immediately available.",,21 days ago,https://ae.indeed.com/company/ITC-FZE/jobs/Office-Assistant-6666d567cd11d42d?fccid=88ce3cb11b5b9b39&vjs=3
Accounts Assistant,MINISO JAPAN - UAE,Dubai,"Should be expert in MS office, MS Excel.
Prepare accounts receivable and payable.
Coordinate with store for Daily sales report and deposit.",,8 days ago,https://ae.indeed.com/company/MINISO---UAE/jobs/Account-Assistant-5025f096d0ef06db?fccid=e98802cc75009961&vjs=3
Hiring for Female Admin Assistant,Multi Masters Technical Services LLC,Dubai,"Knowledge of office management systems and procedures.
Administrative assistant: 2 years (Preferred).
Must have 2 years experience in technical company.",,5 days ago,https://ae.indeed.com/company/Multiplex-Cleaning-Services/jobs/Female-Admin-Assistant-a826ead1734825aa?fccid=cbf11d449b5008f1&vjs=3
Office Administrative Assistant (Female),Maples,Ajman,"Candidate must be Minimum Graduate in Business Administration or equal Degree Holder.
Should have minimum of 2 years of experience in Office Administration.",,17 days ago,https://ae.indeed.com/company/Maples/jobs/Office-Administrative-Assistant-f2d39be88c09d9c9?fccid=18331d27995205b4&vjs=3
Office Assistant/Receptionist,Nursery,Dubai,"We are a British curriculum nursery located in Mankhool, Bur Dubai.
We are currently recruiting for an Female Office Assistant / Receptionist for our nursery,…",,21 days ago,https://ae.indeed.com/company/Cambridgeshire-Nursery/jobs/Office-Assistant-Receptionist-3d27b6c75bf2a0af?fccid=0b938b32a23a479f&vjs=3
Administrative Assistant,Sogefi Properties,Dubai,"Administrative assistant: 1 year (Required).
Admin Assistant Position involves the candidate to handle incoming calls and administration duties of the firm.",,22 days ago,https://ae.indeed.com/company/Sogefi-Properties/jobs/Administrative-Assistant-85ac2da32b25673a?fccid=75d6521f7b49a047&vjs=3
Office Assistant female,Usman Butt Electro Mechanical Services,Umm al-Quwain City,"Office assist cum clark basic computer min intermidite or high school english sopken good looking girl.
Salary: From AED1,500.00 per month.",,3 days ago,https://ae.indeed.com/company/Usman-Butt-Electro-Mechanical-Services/jobs/Office-Assistant-Female-c65f060265ec57ed?fccid=96d88edb37b000e3&vjs=3
Admin Assistant,Asteco Property Management,Dubai,"Administrative assistant: 1 year (Preferred).
Steco Property Management Required Assistant Administrator for for Al Qouz Office*.
Good oral and written skills.",,8 days ago,https://ae.indeed.com/company/Asteco-Property-Management/jobs/Admin-Assistant-fa7e5193d08de547?fccid=6767088391f75da5&vjs=3
Assistant Front Office Manager,Al Khoory Hotels,Dubai,"Conducts internal and cross trainings to all front office staff as per the job requirements and training plan.
FRONT OFFICE SUPERVISOR/ GUEST SERVICE OFFICER.",,30+ days ago,https://ae.indeed.com/company/Al-Khoory-Hotels/jobs/Assistant-Front-Office-Manager-1447108b0b64c446?fccid=c6450f7476e947ee&vjs=3
Receptionist / Personal Assistant,Services LLC,Abu Dhabi,"Daily organization of the reception and office management (stationary stock, uniforms).
We are looking for a Receptionist / Personal Assistant to Managing…",,6 days ago,https://ae.indeed.com/company/SERVICES-LLC/jobs/Receptionist-0c06cd2ad5a0609a?fccid=2de46ab5329b7ea5&vjs=3
